{
  "schema_version": "runsteward.run/v1",
  "run_id": "run:atomic-full-01",
  "task_id": "task:atomic-full-01",
  "created_at": "2026-07-14T00:01:00Z",
  "objective_digest": "sha256:1111111111111111111111111111111111111111111111111111111111111111",
  "objective_summary": "Validate the provider-neutral RunSteward contract core without outward action.",
  "repository": {
    "repository_id": "runsteward",
    "canonical_root": "C:\\repos\\runsteward",
    "source_head": "a0a0a0a0a0a0a0a0a0a0a0a0a0a0a0a0a0a0a0a0",
    "source_tree": "b0b0b0b0b0b0b0b0b0b0b0b0b0b0b0b0b0b0b0b0",
    "dirty_state_policy": "clean-required"
  },
  "lifecycle_policy": {
    "autonomy_mode": "standing-local",
    "approval_mode": "exact-gates",
    "commit_policy": "standing-isolated",
    "push_policy": "forbidden",
    "maximum_runtime_seconds": 36000,
    "inactivity_timeout_seconds": 3600,
    "budget_policy_ref": null,
    "resume_after_stop_policy": "verified-checkpoint-only"
  },
  "status": "allocated",
  "lease_ref": {
    "ref": "contracts/fixtures/scenarios/lease.atomic-full-01.epoch1.active.json",
    "digest": "sha256:fa2c5a7e313c82698864e0eeb46396b4748c5ec5c7068cdfdf83dcfd9391d07d"
  },
  "state_dir": {
    "path": "C:\\runsteward\\state\\run-atomic-01",
    "collision_key": "fs:win32:1111111111111111111111111111111111111111111111111111111111111111"
  },
  "evidence_dir": {
    "path": "C:\\runsteward\\evidence\\run-atomic-01",
    "collision_key": "fs:win32:2222222222222222222222222222222222222222222222222222222222222222"
  },
  "capability_plan_ref": {
    "ref": "contracts/fixtures/scenarios/capability-plan.atomic-full-01.atomic.json",
    "digest": "sha256:f7af3eb5e2ca110ea2ab4979dbb25d9f30ec469fbda26d8cd781374c3aaf83fd"
  },
  "latest_checkpoint_ref": null,
  "sensor_bindings": [],
  "owner_gates": [],
  "stopped_report_ref": null,
  "final_status_report_ref": null,
  "last_event_id": "event:atomic-full-01:4",
  "last_event_sequence": 4,
  "last_event_digest": "sha256:3c747ac271412db848ee2007f19ccceabf630fa058be529aa51a7d9df37f95ab",
  "run_digest": "sha256:ef3151b78a334430501a24fd0b32de32cc113841072542851baf52e914d650f0"
}
