{
  "schema_version": "runsteward.run/v1",
  "run_id": "run:atomic-gated-01",
  "task_id": "task:atomic-gated-01",
  "created_at": "2026-07-14T00:01:00Z",
  "objective_digest": "sha256:1111111111111111111111111111111111111111111111111111111111111111",
  "objective_summary": "Validate the provider-neutral RunSteward contract core without outward action.",
  "repository": {
    "repository_id": "runsteward",
    "canonical_root": "C:\\repos\\runsteward",
    "source_head": "a0a0a0a0a0a0a0a0a0a0a0a0a0a0a0a0a0a0a0a0",
    "source_tree": "b0b0b0b0b0b0b0b0b0b0b0b0b0b0b0b0b0b0b0b0",
    "dirty_state_policy": "clean-required"
  },
  "lifecycle_policy": {
    "autonomy_mode": "standing-local",
    "approval_mode": "exact-gates",
    "commit_policy": "standing-isolated",
    "push_policy": "forbidden",
    "maximum_runtime_seconds": 36000,
    "inactivity_timeout_seconds": 3600,
    "budget_policy_ref": null,
    "resume_after_stop_policy": "verified-checkpoint-only"
  },
  "status": "completed",
  "lease_ref": null,
  "state_dir": {
    "path": "C:\\runsteward\\state\\run-atomic-01",
    "collision_key": "fs:win32:1111111111111111111111111111111111111111111111111111111111111111"
  },
  "evidence_dir": {
    "path": "C:\\runsteward\\evidence\\run-atomic-01",
    "collision_key": "fs:win32:2222222222222222222222222222222222222222222222222222222222222222"
  },
  "capability_plan_ref": {
    "ref": "contracts/fixtures/scenarios/capability-plan.atomic-gated-01.atomic.json",
    "digest": "sha256:95f31288ebbe94603b265d5296b7b8d70f41888ba9e76163f2badd5700f68c36"
  },
  "latest_checkpoint_ref": {
    "ref": "contracts/fixtures/scenarios/checkpoint.atomic-gated-01.claude-not-required.json",
    "digest": "sha256:2dbe2ae6624e3e37e1072ff6a062b6d75a3a23128465e9d6c204b8ef919ecb6a"
  },
  "sensor_bindings": [],
  "owner_gates": [
    {
      "gate_id": "gate:resume-local",
      "owner": "owner:local",
      "state": "satisfied",
      "protected_action": "Authorize resume under the new local lease epoch.",
      "evidence_refs": [
        {
          "ref": "evidence/owner-resume-approval.json",
          "digest": "sha256:aaaaaaaaaaaaaaaaaaaaaaaaaaaaaaaaaaaaaaaaaaaaaaaaaaaaaaaaaaaaaaaa",
          "media_type": "application/json"
        }
      ]
    }
  ],
  "stopped_report_ref": null,
  "final_status_report_ref": {
    "ref": "evidence/run-atomic-gated-01/reports/completed.json",
    "digest": "sha256:d5d4e60a99d0cd62ee07c9aa2e3cacfa4fcb0442bde415d5a1479d11418da4c8"
  },
  "last_event_id": "event:atomic-gated-01:18",
  "last_event_sequence": 18,
  "last_event_digest": "sha256:04a087b0d54cd9b0b9cb89ae8cff7da9bedc10d4f26f76ab7f29aecc707be7bf",
  "run_digest": "sha256:c57af622f4ab2b0b844fcc7ddf61de69dc0cd81c1c6c5be26b2c6ec2d9853c96"
}
