{
  "schema_version": "runsteward.run/v1",
  "run_id": "run:atomic-full-codex-01",
  "task_id": "task:atomic-full-codex-01",
  "created_at": "2026-07-14T00:01:00Z",
  "objective_digest": "sha256:1111111111111111111111111111111111111111111111111111111111111111",
  "objective_summary": "Validate the provider-neutral RunSteward contract core without outward action.",
  "repository": {
    "repository_id": "runsteward",
    "canonical_root": "C:\\repos\\runsteward",
    "source_head": "a0a0a0a0a0a0a0a0a0a0a0a0a0a0a0a0a0a0a0a0",
    "source_tree": "b0b0b0b0b0b0b0b0b0b0b0b0b0b0b0b0b0b0b0b0",
    "dirty_state_policy": "clean-required"
  },
  "lifecycle_policy": {
    "autonomy_mode": "standing-local",
    "approval_mode": "exact-gates",
    "commit_policy": "standing-isolated",
    "push_policy": "forbidden",
    "maximum_runtime_seconds": 36000,
    "inactivity_timeout_seconds": 3600,
    "budget_policy_ref": null,
    "resume_after_stop_policy": "verified-checkpoint-only"
  },
  "status": "completed",
  "lease_ref": null,
  "state_dir": {
    "path": "C:\\runsteward\\state\\run-atomic-01",
    "collision_key": "fs:win32:1111111111111111111111111111111111111111111111111111111111111111"
  },
  "evidence_dir": {
    "path": "C:\\runsteward\\evidence\\run-atomic-01",
    "collision_key": "fs:win32:2222222222222222222222222222222222222222222222222222222222222222"
  },
  "capability_plan_ref": {
    "ref": "contracts/fixtures/scenarios/capability-plan.atomic-full-codex-01.atomic.json",
    "digest": "sha256:f788dbecd9f0ca60ecdfe5f46028fcb72fd0e7774d404964819c8b61f988b854"
  },
  "latest_checkpoint_ref": {
    "ref": "contracts/fixtures/scenarios/checkpoint.atomic-full-codex-01.codex-verified.json",
    "digest": "sha256:c47e826309f0e3d0df2dc3c3e8d0efbbdc631b6d7cbb5a82038976ccc30d377f"
  },
  "sensor_bindings": [],
  "owner_gates": [],
  "stopped_report_ref": null,
  "final_status_report_ref": {
    "ref": "evidence/run-atomic-full-codex-01/reports/completed.json",
    "digest": "sha256:039f37011639bf0eb794a3cb58dcdc5b9a76a5dbf8b2dce4d05eb41deebaf122"
  },
  "last_event_id": "event:atomic-full-codex-01:16",
  "last_event_sequence": 16,
  "last_event_digest": "sha256:8da177ba9e9f678e8b76ec0cebb8ebb2e37ab91322980b342255607565f739b2",
  "run_digest": "sha256:d113bf7072211e56fa1e6627eb9bb0bdb77b989fe37906c851db1f426f0a8a34"
}
