{
  "schema_version": "runsteward.run/v1",
  "run_id": "run:atomic-full-01",
  "task_id": "task:atomic-full-01",
  "created_at": "2026-07-14T00:01:00Z",
  "objective_digest": "sha256:1111111111111111111111111111111111111111111111111111111111111111",
  "objective_summary": "Validate the provider-neutral RunSteward contract core without outward action.",
  "repository": {
    "repository_id": "runsteward",
    "canonical_root": "C:\\repos\\runsteward",
    "source_head": "a0a0a0a0a0a0a0a0a0a0a0a0a0a0a0a0a0a0a0a0",
    "source_tree": "b0b0b0b0b0b0b0b0b0b0b0b0b0b0b0b0b0b0b0b0",
    "dirty_state_policy": "clean-required"
  },
  "lifecycle_policy": {
    "autonomy_mode": "standing-local",
    "approval_mode": "exact-gates",
    "commit_policy": "standing-isolated",
    "push_policy": "forbidden",
    "maximum_runtime_seconds": 36000,
    "inactivity_timeout_seconds": 3600,
    "budget_policy_ref": null,
    "resume_after_stop_policy": "verified-checkpoint-only"
  },
  "status": "stopped",
  "lease_ref": null,
  "state_dir": {
    "path": "C:\\runsteward\\state\\run-atomic-01",
    "collision_key": "fs:win32:1111111111111111111111111111111111111111111111111111111111111111"
  },
  "evidence_dir": {
    "path": "C:\\runsteward\\evidence\\run-atomic-01",
    "collision_key": "fs:win32:2222222222222222222222222222222222222222222222222222222222222222"
  },
  "capability_plan_ref": {
    "ref": "contracts/fixtures/scenarios/capability-plan.atomic-full-01.atomic.json",
    "digest": "sha256:f7af3eb5e2ca110ea2ab4979dbb25d9f30ec469fbda26d8cd781374c3aaf83fd"
  },
  "latest_checkpoint_ref": {
    "ref": "contracts/fixtures/scenarios/checkpoint.atomic-full-01.claude-not-required.json",
    "digest": "sha256:14f59770d4d26a62567f48a7d37aa2667461c19684751d04a7042a678fad4fab"
  },
  "sensor_bindings": [],
  "owner_gates": [],
  "stopped_report_ref": {
    "ref": "evidence/run-atomic-full-01/reports/stopped.json",
    "digest": "sha256:a601bc26b09c0ba4d79b22fb2ceddcd4a13d8a97b7da532ba9ae9eeed4ac4724"
  },
  "final_status_report_ref": null,
  "last_event_id": "event:atomic-full-01:10",
  "last_event_sequence": 10,
  "last_event_digest": "sha256:c98005aa36d375ba8f00739c7927c929eef78cfb450ed0b96757d95343876ee7",
  "run_digest": "sha256:0d2db9854127cb4e8930ddd03c6735e5e440f7ee0e6be9f60e3f84a494ded32b"
}
